Name,Author,Path,Servings,Ingredients,Instructions
Tagliatelle Carbonara with Crispy Mushrooms Recipe,Molly Krebs,home/recipes/main-courses/grains-legumes-pasta/Tagliatelle Carbonara with Crispy Mushrooms Recipe,4 servings,  2 large eggs 2 large egg yolks 1 1/2 cups finely grated parmesan cheese divided plus extra for serving  3/4 teaspoon salt  3/4 teaspoon freshly cracked black pepper 8 slices thick-cut bacon chopped  3/4 cup extra virgin olive oil 1 pound wild mushrooms sliced 1 pound tagliatelle pasta  1/2 cup reserved pasta water 1 teaspoon finely chopped fresh rosemary 1-2 tablespoons chopped fresh parsley	 Fresh basil leaves for serving   ,In a medium mixing bowl whisk together the eggs egg yolks 1 cup of the parmesan cheese salt and pepper until smooth. Set aside while you prepare the rest of the ingredients.  Heat a large skillet over medium-high heat and add the chopped bacon. Cook for 8 minutes or until bacon is golden brown and crispy. Remove bacon from pan and add to a paper towel lined plate. Pour bacon fat into a small bowl leaving 1-2 tablespoons in the pan for the mushrooms. Save the reserved bacon fat for the sauce later. Meanwhile bring a pot of salted water to a boil for the pasta.  Add  3/4 cup olive oil to the skillet with the 1-2 tablespoons of bacon fat. Heat over medium-high heat and once hot add the mushrooms and a few cracks of freshly ground black pepper. Cook for 12-15 minutes tossing the mushrooms only a few times so that they get deeply golden and crispy. Once they're finished season with salt and stir in the chopped rosemary. Remove mushrooms from pan and set aside. Add the reserved bacon fat to the skillet so that it's ready for the pasta!  At this point your pasta water should be boiling. Add your pasta and cook according to package directions or until just al dente. Remember to reserve your pasta water (I just scoop a bunch out with a large mug or heat-safe glass measuring cup!) Drain pasta and quickly pour it back into the pan with the bacon fat. Quickly add the egg-parmesan mixture and a splash of pasta water (start with 1/4 cup) and working quickly using tongs toss the pasta to combine it with the mixture to create a creamy "sauce". Add the remaining 1/2 cup of parmesan cheese and keep tossing until melted and combined. Add a splash or so more of the pasta water (up to the remaining  3/4 cup) if it seems like it needs more moisture. Season with freshly cracked black pepper. You most likely won't need any salt since bacon and parmesan are salty enough on their own! Add chopped fresh parsley and toss once more. Top with the crispy mushrooms. Serve immediately with extra grated parmesan and fresh basil.  
Creamy Chicken & Mushroom Stew,Kayla Howey,home/recipes/main-courses/poultry/Creamy Chicken & Mushroom Stew,4 servings,   3/4 lb bacon diced  1/2 lb shiitake mushrooms trimmed + halved  1/2 lb baby portobello mushrooms stemmed + thinly sliced kosher salt 2 tbsp butter 1 medium onion diced 1 large leek thinly sliced 4 garlic cloves minced  1/2 tsp crushed red pepper 1 lb carrots peeled + sliced  1/4" 1 tbsp all-purpose flour  1/2 cup white wine 1  1/2 lbs bone-in skin-on chicken breasts 1 small handful fresh oregano + sage tied in kitchen twine 1 qt chicken stock 1 bunch red chard stemmed + roughly chopped 1 (15 oz) can butter beans 2 tbsp heavy cream 2 tbsp chopped parsley freshly shaved parmesan cheese for topping freshly cracked black pepper for topping   ,Heat a 7qt Dutch oven over medium-high heat. Add the bacon. Cook for about 6 minutes to start the rendering process stirring often. Reduce the heat to low and continue to render until the bacon is crisp. Use a slotted spoon to transfer the bacon to a plate lined with paper towels.   Leave 2 tablespoons of bacon fat in the pot carefully discarding the rest. Increase the heat to medium-high. Add the mushrooms. Cook for about 8 minutes until caramelized and tender. Season with a pinch of salt. Transfer the mushrooms out of the pot.   Reduce the heat to medium and add the butter. Once melted add the onion and leeks. Saute for about 6 minutes. Season with a pinch of salt. Stir in the garlic and crushed red pepper. Cook for a minute or so.   Add the carrots. Stir in the flour and cook for a minute or so. Pour in the white wine and stir well. Add the chicken and herbs to the pot along with the chicken stock. Bring the liquid to a boil. Reduce to a simmer and cook for approximately 40 minutes or until the chicken is cooked through.   Transfer the chicken to a cutting board. Stir the red chard and beans into the stew. Shred the chicken discarding the skin and bones. Add the chicken back to the pot. Lastly stir in the heavy cream and parsley. Season with salt to taste.   Ladle the stew into bowls. Top with the bacon parmesan cheese freshly cracked black pepper and any extra herbs. 
Glazed Lemon Yogurt and Olive Oil Pound Cake,Aran Goyoaga,home/recipes/desserts/cakes-custards/Glazed Lemon Yogurt and Olive Oil Pound Cake,1 LOAF, For the cake  1 cup (200 g) sugar 1 tablespoon finely grated lemon zest (from 2 to 3 medium lemons)  1 cup (140 g) superfine brown rice flour 1 cup (100 g) almond flour any lumps broken up 3 large eggs  1/2 cup (115 g) whole-milk yogurt or Cashew-Coconut Yogurt   1/2 cup (110 g) extra-virgin olive oil plus more for greasing 1 tablespoon vanilla extract 1 tablespoon baking powder  1/2 teaspoon kosher salt    For the glaze  2 cups (240 g) powdered sugar 2 to 3 tablespoons freshly squeezed lemon juice 2 tablespoons finely chopped pistachios for topping   ,This is the basic snack cake of my childhood. I would come home from school to find it displayed on an old red melamine tray cooling on the outdoor balcony. It is very lemony and moist with a simple glaze. You can add orange zest or poppy seeds to it if you'd like.  1.    Preheat the oven to 350 degrees F. Grease the inside of an 8 1/2-by-4 1/2-inch loaf pan with a little bit of olive oil.  2.    To make the cake in a large bowl rub together the sugar and lemon zest until fragrant. This helps release the natural lemon oil. Whisk in the remaining ingredients until the batter is smooth. Pour the batter into the prepared pan and bake for 45 to 50 minutes until a toothpick inserted in the center comes out clean. Let the cake cool in the pan for 15 minutes then invert onto a wire rack. Let the cake cool completely if you want the glaze to stay thick on top of the cake. If the cake is warm the glaze will melt and run off.  3.    To make the glaze in a medium bowl whisk together the powdered sugar and lemon juice until smooth and lump free. As you begin to whisk it might seem too thick but as the sugar absorbs the juice the glaze will thin out. The glaze should be pourable but not too runny.   4.    Put a tray or baking sheet under the wire rack and pour the glaze all over the cake letting it run over the edges. Wait a few minutes for the glaze to set. Sprinkle the top with the pistachios then serve. The cake will keep at room temperature for 3 days. If you refrigerate it the glaze will soften.  Copywrite 2021 by Aran Goyoaga. Excerpted from Cannelle et Vanille Bakes Simple: A New Way to Bake Gluten-Free by permission of Sasquatch Books. 
Spider Web Chocolate Brownies,Tested and perfected in the Sur la Table kitchen,home/recipes/desserts/cookies-bars-brownies/Spider Web Chocolate Brownies,16 brownies,  Brownies:  4 ounces (1 stick) unsalted butter plus extra for greasing baking dish  6 ounces (1 cup) semisweet chocolate chips  1 cup granulated sugar  2 large eggs  1 teaspoon vanilla bean paste   1/2 cup unbleached all-purpose flour   1/2 teaspoon sea salt    Chocolate glaze:  3 ounces ( 1/2 cup) semisweet chocolate chips   1/2 cup heavy whipping cream    Spider web:  6 ounces (1 cup) white chocolate chips melted    ,Preheat the oven to 350 degrees F with oven rack placed in the center.   To prepare the baking dishes: Grease an 8 inch baking pan and line with parchment paper that overhangs from two edges of the pan. You will use the paper to help you remove brownies from the dish when baked.     To prepare the chocolate: Place butter and chocolate in a medium saucepan and place over low heat stirring occasionally with a wooden spoon until melted. Remove the saucepan from the heat and cool slightly.     To prepare the egg mixture: In a large mixing bowl whisk together sugar eggs and vanilla until the mixture is pale and fluffy about 2 minutes.     To prepare the batter: Pour the melted chocolate into the egg mixture whisking to combine. Use a silicone spatula to mix the flour and salt into the batter.     To bake: Pour the mixture into the prepared pan transfer to the oven and bake until the brownies are just set and the center is slightly gooey 25 to 30 minutes. Cool completely remove from the pan and cut into 16 2-inch squares.    To prepare the glaze: Add chocolate chips to a heatproof bowl. To a small saucepan set over medium heat add cream and bring to a simmer. Pour cream over chocolate and allow to stand for 5 minutes. Whisk chocolate and cream together until fully melted and combine; allow to sit for about 10 minutes to set up slightly.    Pour the melted white chocolate into a disposable piping bag.    To assemble: Dip the flat side (bottom side) of each brownie square into chocolate glaze. Set the brownie glazed side up on a plate. Cut off a small tip of disposable piping bag with white chocolate. Working with one brownie at a time pipe white chocolate over the glaze in a spiral starting from the center and moving toward the edge. Use a wooden skewer or a toothpick to drag the white chocolate from the center towards the edge creating the spider web design. Clean the tip of the skewer each time you drag it through chocolate for a clean look. Repeat with remaining brownies glaze and chocolate. Refrigerate brownies until setup. 
Cupid's Whoopie Pies,Tested and perfected in the Sur la Table kitchen,home/recipes/desserts/pies-pastries-tarts/Cupid's Whoopie Pies,12 to 14 pies,  For the pies: 2 1/2 cups unbleached all-purpose flour 2 tablespoons cocoa powder 1 teaspoon baking powder 1 teaspoon kosher salt 1/2 cup (1 stick) unsalted butter room temperature 1 1/2 cups granulated sugar 3 large eggs room temperature 3/4 cup buttermilk room temperature 1 teaspoon vanilla bean paste 2 teaspoons red gel food coloring plus more if needed 1 1/2 teaspoons baking soda 1 tablespoon distilled white vinegar  For the filling: 16 ounces (2 packages) cream cheese softened 3/4 cup (1 1/2 sticks) unsalted butter softened 2 teaspoons vanilla bean paste 4 cups confectioners' sugar plus more for decorating sifted 1/2 teaspoon kosher salt  ,Decorate these delicious red velvet whoopie pies with confectioners' sugar and stencils or by piping decorations with leftover filling. Print out the heart template on the last page. If using parchment paper trace hearts with pencil or marker then place the ink-side down on the rimmed baking sheet. If using silicone baking mats print out multiple templates and place them below the mat on the rimmed baking sheet.  Preheat oven to 375 degrees F and line 3 rimmed baking sheets with traced parchment paper or silicone baking mats with templates set below.   To prepare batter: Set a fine-mesh strainer over a medium bowl. Add flour cocoa baking powder and salt; sift into the bowl set aside.  To the bowl of a stand mixer fitted with a paddle attachment add butter and sugar. Cream the mixture by beating on medium speed until light and fluffy scraping sides of bowl as needed. Add one egg at a time mixing well in between and scraping sides of bowl as needed.   To a liquid measuring cup add buttermilk vanilla and food coloring mix with a fork. Alternate adding the flour mixture and the milk mixture to the creamed butter beating on low after each addition until just combined.   To a small bowl add the baking soda and vinegar mix with a fork. Add vinegar mixture to the batter and beat until just combined.  Transfer batter into one large or two medium-size pastry bags fitted with a large open-round piping tip. Pipe batter into heart shapes using the templates as a guide (best to pipe batter into a thick "v" shape then use an offset spatula to round out edges).  To bake: Transfer baking sheets to the preheated oven and bake until cakes are puffed and the tops spring back slightly when touched 10 to 12 minutes. Cool completely.  To prepare frosting: To the bowl of a stand mixer fitted with a whisk attachment add cream cheese butter and vanilla; whisk on medium until combined stopping to scrape the sides of the bowl as needed. Slowly add confectioners' sugar and salt whip until smooth and fluffy about 2 minutes on high speed.  To assemble whoopie pies: Match the cakes in pairs of two similar size and shaped cakes flip one of each match so that the flat side is facing up.  To the flat side place about 2 tablespoons of frosting and using an offset spatula spread into an even layer. Repeat with the remaining flat-side up cakes.  Transfer remaining frosting into a piping bag fitted with a medium-small open round tip. Pipe and decorate the dome-side up cakes as desired.  Place the decorated cake on top of its matched frosted bottom and press gently to adhere the sides together. Serve immediately or place in an airtight food storage container and refrigerate for up to 1 week.  Decorating ideas: Pipe sweet words such as; Sweet Sweetheart and Love onto top cake. Pipe people's names on to top cake. Pipe hearts dots or flowers onto top cake. Dust a plain top with confectioners' sugar. 
SPINACH TAGLIATELLE,Tested and perfected in the Sur La Table kitchen,home/recipes/main-courses/grains-legumes-pasta/SPINACH TAGLIATELLE,rvings,  3 ounces spinach washed and trimmed 1/2 teaspoon fine kosher salt plus more for salting water 1 large egg 1 large egg yolk 1 1/4 cups (6 1/4 ounces) all-purpose flour plus more for dusting Semolina flour for dusting pasta and surfaces    ,Tagliatelle pappardelle tagliolini are just a few of our favorite hand-cut ribbon pasta. The only difference between the shapes is the width in which it is cut. Tagliatelle meaning "cut" in Italian is cut to 1/3-inch pappardelle to 3/4-inch and tagliolini to 1/8-inch. The general rule of thumb for the sauce is the wider the ribbon the heavier the sauce.   1. To blanch spinach:   Fill a large pot of water and bring to a rolling boil. Generously salt water. Add spinach to boiling water and cook until tender about 30 seconds. Using tongs transfer spinach to a colander and rinse under cold water. Thoroughly spin dry spinach in a salad spinner or wring dry in a clean kitchen towel.  2. To prepare dough: To the bowl of a food processor fitted with a metal blade puree spinach. Add eggs and yolk to puree and process until well combined. Add flour and 1/2 teaspoon of salt and process until dough comes together about 20 seconds.  3. Transfer dough to well-floured surface. Knead dough until it is smooth and flexible but not sticky adding small amounts of flour as needed 6 to 8 minutes. Gather dough into a ball and flatten into a disk. Cover in plastic wrap and allow dough to rest for at least 10 minutes and up to 1 hour at room temperature.  4. To roll out and cut dough:  Secure a pasta machine to edge of a long countertop. Using a bench scraper cut dough into 2 pieces. Keep extra dough covered in plastic wrap while working with one piece. With a rolling pin or your hand roll or flatten dough into a rough rectangle that will fit inside widest setting of pasta machine. Roll dough through machine catching it with one hand as you roll with other. Take dough and trifold it like a letter. Turn dough so one open end faces machine and roll it through on widest setting again. Fold turn and roll once more on the widest setting.   5. Continue rolling pasta through machine without folding adjusting rollers to a smaller setting each time. Roll out each sheet to second to last thinnest setting. If pasta sheet becomes too large to handle use a bench scraper to cut it into more manageable lengths and continue rolling.   6. To shape the tagliatelle:  Liberally flour one sheet of pasta and loosely roll it into a cylinder. Using a sharp knife cut roll into 1/3" ribbons. Unwrap ribbons toss them with semolina flour and form into piles on baking sheets dusted with semolina. The pasta can be cooked immediately or covered with plastic wrap and refrigerated for up to 24 hours before use.  7. To cook the pasta: To a large pot of water set over high heat add water to 2/3 full and bring to a boil. Generously season water with salt. Add pasta and stir immediately to prevent tagliatelle from sticking together. Boil until al dente 2 to 3 minutes. Reserve 1 cup of pasta water and drain pasta through a colander. Use reserved pasta water to thin your chosen pasta sauce. 
Crispy Sheet Pan Gnocchi With Vegetables,Jessica Lawson,home/recipes/main-courses/grains-legumes-pasta/Crispy Sheet Pan Gnocchi With Vegetables,1 serving,  1 17.6oz package of shelf-stable gnocchi (uncooked)   1 pint grape or cherry tomatoes   1 12oz bag baby bell peppers quartered (or 2 bell peppers cut into chunks)    1/2 medium red onion cut into  1/2 inch slices   4 cloves garlic smashed with peel on    1/2 teaspoon dried oregano    1/2 teaspoon dried parsley    1/4 cup olive oil    1/2 teaspoon salt   1/4 teaspoon black pepper   1 tablespoon red wine vinegar (or fresh lemon juice)   1/4 cup chopped fresh basil   2-3 cups arugula for serving (optional)   Shaved parmesan for serving    ,Preheat oven to 425 degrees F. Cut baby bell peppers into quarters removing seeds and stems.  Slice red onion into  1/2-inch sections.  Smash unpeeled garlic cloves.  In a large bowl combine the peppers tomato red onion dried oregano and dried parsley  1/4 teaspoon of salt and black pepper to taste. Toss vegetable mixture together with 2 tablespoons of olive oil.  Add gnocchi to the sheet pan and toss with 1 tablespoon of olive oil salt and pepper. Spread in a single layer covering about  1/3 of the sheet pan.  Add the vegetables to the remaining space on the sheet pan.  Add unpeeled garlic cloves on top of vegetables and drizzle with a bit of olive oil.  Bake at 425 degrees F for 20-25 minutes until gnocchi are slightly golden and crispy and vegetables are cooked through with a little bit of char. Tomatoes will begin to burst and become jammy.  Remove garlic cloves from the pan peel and mash together with remaining olive oil red wine vinegar and a pinch of salt.  Pour dressing onto sheet pan and gently stir all ingredients together with a wooden spoon.  Divide arugula into serving dishes and top with gnocchi and veggies.  Garnish with fresh basil and shaved parmesan. 
Vanilla Bean Caffe Latte,Sonoma Syrup Co.,home/recipes/beverages/hot-beverages/Vanilla Bean Caffe Latte,1 serving,  1 tbsp. Sonoma Syrup Co. Vanilla Bean Simple Syrup 1-2 shots espresso* 3/4 cup steamed milk Whipped cream Cocoa powder   ,Pour Sonoma Syrup Co. Vanilla Bean Simple Syrup in a mug. Add freshly brewed espresso and steamed milk. Top with whipped cream and sprinkle cocoa powder on top.  Recipe Note:  **1 shot = 1/8 cup. 1/4 cup strongly brewed coffee may be substituted for one shot.  
Wild Mushroom Gravy,Recipe developed for Sur La Table's Cooking Classes,home/recipes/appetizers/dips-spreads-sauces-seasonings/Wild Mushroom Gravy,about 7 cups,  2 ounces dried porcini mushrooms 4 cups poultry stock or low-salt chicken broth divided 2 tablespoons unsalted butter divided  1 pound fresh wild and domestic mushrooms such as chanterelle shitake and crimini cleaned stemmed and sliced     1/2 cup dry white wine divided    3 tablespoons turkey fat drippings or unsalted butter   3/4 cup unbleached all-purpose flour  1 large shallot chopped (about  1/2 cup)   3 large garlic cloves chopped   1 teaspoon chopped fresh thyme leaves   1 teaspoon chopped fresh sage leaves    1/2 cup creme fraiche    1 1/2 teaspoons chopped fresh tarragon     ,Make sure to save the turkey neck and giblets except the liver to make a delicious stock to flavor your gravy.  Add stock and dried porcinis to a medium saucepan place over medium-high heat. Bring to a simmer and reduce heat to low cover and steep dried mushrooms while preparing gravy.     In a large skillet over medium-high heat add knob of butter. When foam subsides add mushrooms to cover the bottom of the pan in a single layer. Season mushrooms with salt and pepper and cook until browned and tender about 3 minutes. Add enough wine to the pan to deglaze when pan is almost dry transfer mushrooms to a plate or bowl and set aside repeat cooking procedure with remaining mushrooms.  In a large skillet or empty turkey roasting pan over medium-high heat add turkey fat drippings. Add shallot and garlic. Cook until translucent about a minute. Reduce heat to medium-low whisk in flour to make a thick paste called a roux; cook until flour just lightly colors and smells like toasted almonds about 2 minutes.   Strain stock through a fine-mesh sieve into a large liquid measuring cup or pitcher. Increase the heat under the skillet with the roux to medium-high. Slowly pour stock into the skillet while whisking vigorously. Once gravy is thickened and bubbling add sauteed mushrooms and herbs. Reduce heat to a simmer and cook for 10 minutes or until gravy has a rich velvety texture. Taste and adjust seasoning with salt and pepper. (Recipe can be prepared up to this stage 1 to 2 days ahead cover and refrigerate rewarm before continuing.)  To finish: Whisk creme fraiche and tarragon into gravy and serve.   
Zucchini Cake with Crispy Prosciutto,KitchenAid,home/recipes/desserts/cakes-custards/Zucchini Cake with Crispy Prosciutto,8 servings,  1 (3-ounce) package prosciutto 2 cups unbleached flour 1 tablespoon baking powder  1/2 teaspoon salt   1/2 teaspoon black pepper freshly ground  1/2 cup cold unsalted butter cut into pieces   1/2 cup plain Greek yogurt 2 large eggs  3/4 cup green onion sliced 4 ounces feta cheese crumbled  1/2 cup parsley 1 large zucchini ends trimmed cut into 4-inch pieces   ,Preheat oven to 400 degrees F. Place prosciutto on baking sheet lined with parchment. Bake until crisp 10-15 minutes. Remove from oven and let cool. Reduce heat to 350 degrees F. Place flour baking powder salt and pepper into bowl of food processor. Pulse 3 to 4 times to combine. Add butter and pulse until sandy in texture. In a separate bowl combine yogurt eggs green onion feta cheese and parsley. Attach Vegetable Sheet Cutter Attachment to KitchenAidreserved  Stand Mixer. Insert the food holder and zucchini/cucumber adapter into the center of both ends of zucchini section aligning the red marks. Secure zucchini and food holder onto attachment. Insert food skewer through zucchini/cucumber adapter and all the way through zucchini. Attach Thin Blade to attachment. Position bowl under blade to catch zucchini. Turn Stand Mixer to Speed 2 and position blade against zucchini to process. Repeat with remaining zucchini sections. Cut zucchini sheets into 5-inch lengths and then vertically into four slices. Chop left-over zucchini cores into  3/4-inch pieces. Gently fold yogurt egg mixture and chopped zucchini core into flour mixture. Spread into 9x5 loaf pan coated with cooking spray. Push zucchini sheets vertically and randomly into batter letting some of the edges peek from the top. Crumble prosciutto and sprinkle over the top. Bake until pick comes out clean about 1 hour and 15 minutes. Let cool in pan for 15 minutes then transfer to cooling rack. Cool completely before serving.  
