Name,Author,Path,Servings,Ingredients,Instructions
Cinnamon Pull-Aparts,Nordic Ware,home/recipes/breakfast/doughnuts-muffins-more/Cinnamon Pull-Aparts,8 pull-apart bun cakes,  2 cups plus 1 teaspoon all-purpose flour 1 3/4 teaspoon baking powder  1/2 teaspoon baking soda 3 tablespoons cinnamon divided 1 teaspoon flake sea salt or kosher salt divided 8 tablespoons unsalted butter 1 3/4 cups granulated sugar  3/4 cup brown sugar 3 eggs 2 teaspoons vanilla extract 1 3/4 cups full fat plain Greek yogurt or sour cream  Icing: 1 cup confectioners' sugar 1 teaspoon vanilla extract Pinch of salt 1 1/2 tablespoons whole milk  3/4 cup chopped toasted pecans   ,Have all ingredients at room temperature.  Preheat oven to 350 degrees F. Grease and flour the Cinnamon Bun Pull-Apart Pan; tap out excess flour.  To make the cake: In a bowl whisk together 2 cups flour baking powder baking soda 2 Tbsp. cinnamon and  1/2 tsp. salt. Set aside.  In a separate small bowl combine 1 tsp. flour 1 Tbsp. cinnamon  3/4 cup brown sugar  1/2 tsp. salt and  3/4 cup finely chopped toasted pecans. Set aside.  In the bowl of an electric mixer fitted with the flat beater beat the butter on high speed for 1 minute. Add the granulated sugar and continue beating until the mixture is pale and fluffy about 5 minutes stopping the mixer occasionally to scrape down the sides of the bowl. Reduce the speed to medium add the eggs and continue mixing for 1 minute scraping down the sides of the bowl after each addition. Add the vanilla and beat until incorporated.  Reduce the speed to low and add the flour mixture in 3 additions alternating with the Greek yogurt and beginning and ending with the flour. Beat each addition until just incorporated stopping the mixer occasionally to scrape down the sides of the bowl.  Pour 2/3 of batter into the prepared pan and using a spatula spread the batter evenly. Use the back of a spoon to make a trough in a circle around the middle of the cake. Fill with reserved cinnamon-sugar-pecan mixture then top with remaining  1/3 of batter. Draw a butter knife gently through the batter to swirl the cinnamon tunnel inside. Bake until a toothpick inserted into the center comes out clean 40 to 45 minutes.  Transfer the pan to a wire rack and let the cake cool in the pan for 10 minutes. Invert the cake onto the rack and let cool 30 minutes.   To make the icing: In a bowl whisk together the confectioners' sugar vanilla salt and milk until smooth. Drizzle evenly over the top of the cake after it has cooled for 30 minutes but is still warm. Sprinkle with remaining  1/2 cup toasted pecans.    
Focaccia Ligure,Academia Barilla adapted by the Sur La Table kitchen,home/recipes/breads/yeast-breads/Focaccia Ligure,10 servings,  17 1/2 oz (500g) water warm (105 degrees F to 115 degrees F) 1 oz (30g) quick rise yeast 1 tablespoon (15g) barley malt or sugar 2 pounds (900g) Caputo 00 Pizza Flour  1/3 cup (100g) boiled mashed potatoes 1 tablespoon (25g) salt 3 1/2 oz (100g) Extra Virgin Olive Oil Riviera Ligure DOP Academia Barilla  For the preparation of the solution:  1/2 cup water 1 tablespoon salt  1/3  cup (for 21 oz. of dough) Extra Virgin Olive Oil Riviera Ligure DOP Academia Barilla 4 teaspoons Sapori Italiani Academia Barilla to taste   ,Focaccia is a popular Italian yeast bread which is sometimes compared to pizza as they are both are flat breads. The focus of focaccia however is on the bread rather than the toppings although toppings for focaccia are almost as diverse as those on pizza.   The top of the focaccia is dimpled and brushed with oil to keep the bread moist and flavorful. The dimpling in the dough is usually accomplished by poking it gently with the fingers just before dressing the bread. The dimples collect oil and any added herbs and spices-creating pockets of flavor. A well-made focaccia should feel light and flavorful not greasy and heavy.  In Italy flour is classified either as 1 0 or 00 and refers to how finely ground the flour is and how much of the bran and germ have been removed. Doppio zero is the most highly refined and is talcum-powder soft. It's made from spring wheat in the Campania region of Italy '00' flours work beautifully for breads pasta and pizza.   Place pizza stone the oven and preheat oven to 475 degrees F. The stone needs to heat in the oven for  1/2 hour to 1 hour before baking focaccia.  Place the warm water in large bowl. Sprinkle in dry yeast and barley malt or sugar; stir with fork. Let stand until yeast dissolves about 10 minutes.  Add flour mashed potatoes and salt to yeast mixture and stir to blend well (dough will be sticky). Knead dough on a floured surface until smooth and elastic adding more flour by tablespoon increments if dough is too sticky about 10 minutes. Form dough into ball. Oil large bowl; add dough turning to coat. Cover with plastic wrap and let rise in warm area until doubled about 1 hour. Punch down dough; divide the dough into pieces of about 21 oz. each then shape each piece into round or cylindrical shapes about  1/2 inch thick.  Using your fingers put divots in the dough and brush the dough with the water salt and olive oil mixture (the 'solution'). Sprinkle dough with Sapori seasoning. Using a pizza peel slide the dough onto the pre-heated pizza stone. Cook for about 18-20 minutes and serve.   
Apple Cider Old Fashioned Doughnuts,Recipe developed for Sur La Table's Cooking Classes,home/recipes/breakfast/doughnuts-muffins-more/Apple Cider Old Fashioned Doughnuts,12 medium or 24 mini doughnuts,  Apple cider doughnuts: 2 cups apple cider 4 1/2 cups unbleached all-purpose flour 1 tablespoon baking powder 1 teaspoon baking soda 1 teaspoon sea salt 2 teaspoons ground cinnamon  1/2 teaspoon freshly grated nutmeg 6 tablespoons unsalted butter melted  1/2 cup granulated sugar  1/2 cup packed light brown sugar 2 large eggs  1/2 cup buttermilk 1 teaspoon vanilla bean paste 2 granny smith apples peeled cored and cut into small dice About 2 quarts vegetable oil for deep frying  Cinnamon sugar: 1 cup granulated sugar 3 tablespoons ground cinnamon   ,This is the perfect doughnut to celebrate fall. Scented with warm spices flavored with cider and studded with tart apples these doughnuts are best served the same day they are made.  In a small saucepan add apple cider and bring to a boil over medium-high heat. Reduce cider down to  1/2 cup about 20 minutes. Set aside to cool.   Sift together the flour baking powder baking soda salt and spices into a medium bowl and set aside.  In a bowl of a stand mixer fitted with a paddle attachment cream together the butter with both the sugars until light and fluffy. Scrape the sides and bottom of the bowl occasionally with a silicone spatula. Add eggs one at a time mixing until each addition is incorporated. Add the reduced cider buttermilk and vanilla and mix until well combined. Add the flour mixture and mix until well incorporated. Fold in apples and stir until combined.   Lightly dust a work surface with flour turn the dough out and roll into a 12-inch by  1/2-inch thick round. Using floured 3 1/2-inch and 1 1/2-inch ring cutters cut out the doughnuts and holes; gather and reuse the dough scraps. Pour the oil to 4 inches deep in a large heavy-saucepan or a deep fryer with deep-fry thermometer attached and heat to 325 degrees F.  Working in batches carefully place the doughnuts in the oil cook flipping once until puffed and golden about 3 to 4 minutes. Using a slotted spoon transfer to wire rack placed over a baking sheet.   In a large bowl combine the sugar with the cinnamon and mix until thoroughly combined. Toss warm doughnuts in the cinnamon sugar and shake off excess.   
Spicy Shrimp Simmered in Basil,Tested and perfected in the Sur la Table kitchen,home/recipes/main-courses/seafood/Spicy Shrimp Simmered in Basil,4 servings,  1 pound medium shrimp peeled and deveined chopped into  1/2-inch pieces 2 tablespoons fish sauce divided plus more as needed 2 tablespoons lime juice divided plus more as needed 4 tablespoons vegetable or canola oil 2 medium shallots peeled and thinly sliced 1 large clove garlic peeled and finely minced 3 medium kaffir lime leaves roughly chopped 1 to 2 Thai red chiles or 2 serrano chiles stems trimmed thinly sliced 1 large bunch Thai or sweet basil leaves stems removed divided 3 tablespoons firmly packed palm sugar or light brown sugar plus more as needed   ,Unlike a traditional stir-fry this dish is cooked over medium heat to allow the aromatics to infuse the cooking oil with loads of flavor. Basil and fish sauce are both added at the beginning and the end of cooking to build a great depth of flavor in this Thai-style dish. If you're using Thai chiles are extremely hot; you can reduce the heat by removing the seeds before adding them to this dish.   To marinate shrimp: Place shrimp 1 tablespoon fish sauce and 1 tablespoon lime juice into a medium mixing bowl and toss until thoroughly coated in the marinade.  Cover and refrigerate shrimp for 10 minutes.  To cook shrimp: Place oil in a large wok or skillet on the stove over moderate heat. Add the oil and when shimmering add the shallots garlic lime leaves chiles and 2/3 of the basil leaves and cook stirring frequently until shallots are golden brown about 8 to 10 minutes.   Increase heat to moderate-high and add the shrimp stirring frequently until firm and no longer pink (about 3 to 4 minutes). Stir in the remaining tablespoon of fish sauce and lime juice. Add the palm sugar and stir until combined. Add the remaining basil and cook stirring constantly until the basil wilts about 1 minute. Taste and season with additional fish sauce lime juice and palm sugar as desired.    
Basic Tomato Sauce,Tested and perfected in the Sur La Table kitchen,home/recipes/appetizers/dips-spreads-sauces-seasonings/Basic Tomato Sauce,4 servings,  2 tablespoons extra-virgin olive oil 1 onion finely chopped 1 medium garlic clove minced 1 (28-ounce) can plum tomatoes drained and juices reserved 6 basil leaves roughly chopped 1 teaspoon sugar more if desired  3/4 cup water Kosher salt and freshly ground black pepper   ,The key to making a good tomato sauce is good ingredients which must include good canned tomatoes. Sugar is added to the sauce to cut the acidity in the tomatoes. Place a large skillet on the stove over medium-high heat and add the olive oil. When the oil is shimmering add the onion and cook until soft about 7 minutes. Add the garlic and cook until fragrant about 1 minute.   Stir the whole tomatoes into the skillet bring to a simmer and cook until starting to soften about 3 minutes. Using the back of a wooden spoon crush the tomatoes and continue to cook until soft and the liquid is almost evaporated about 3 minutes.  Add the reserved tomato juice basil and sugar and cook until the sauce thickens about 5 minutes. Stir in  3/4-cup water reduce the heat to medium-low and cook until the sauce is thick. Taste and adjust seasoning with salt and pepper.   
Leftover Butternut Squash Hummus,Recipe courtesy of Scraps,home/recipes/appetizers/dips-spreads-sauces-seasonings/Leftover Butternut Squash Hummus,4 cups (6 to 8 servings)  Learn more about Scraps ,    1/3 of a butternut squash cooked 2 tablespoons raw pepitas 2 teaspoons whole coriander seeds lightly crushed 2 teaspoons raw sesame seeds 1 teaspoon Aleppo-style pepper divided plus more  2 garlic cloves grated  3/4 cup tahini  Juice of one lemon  2 teaspoons pure maple syrup  1/2 teaspoon ground cumin Extra-virgin olive oil Kosher salt to taste Assorted raw vegetables for dipping   ,Toast the seeds: In a medium dry skillet over low heat add the pepitas coriander and sesame seeds. Cook tossing or stirring frequently until lightly toasted and fragrant. Add  1/2 teaspoon Aleppo pepper and a generous drizzle of olive oil. Keep warm.   Make the hummus: Add squash garlic tahini lemon maple and cumin to a food processor. Season with salt and remaining  1/2 teaspoon Aleppo pepper.  Process until smooth while drizzling in about  3/4 cup olive oil. Taste and add more salt if needed.   Serve: Spread hummus onto a shallow platter and smooth with the back of a spoon. Top with warm seed mixture. Serve alongside vegetables. Drizzle everything with more olive oil before serving.  
Carrot Top Pesto,Recipe developed for Sur La Table's Cooking Classes,home/recipes/appetizers/dips-spreads-sauces-seasonings/Carrot Top Pesto,4 servings,  Coarse sea salt 1 pound dried pasta such as linguini or spaghetti Tops from 2 bunches carrots (stems and all) coarsely chopped about 2 cups  1 cup basil leaves 2 garlic cloves chopped  3/4 cup chopped toasted blanched almonds  1/2 cup extra-virgin olive oil or as needed  1/2 cup freshly grated Parmigiano-Reggiano cheese Freshly ground black pepper     ,To a large pot filled with cold water add a couple handfuls of salt and bring to a boil over high heat. Add the pasta and cook until al dente about 10 minutes.   While the pasta is cooking to the Vitamix add carrot tops basil leaves garlic and almonds. Pulse until everything is finely chopped. With the Vitamix turned on slowly drizzle the oil through the lid opening until the pesto is creamy and about the thickness of mayonnaise. You do not need to use all of the oil.   Pulse a little bit of pasta water and half the cheese into the pesto. Taste and adjust seasoning with salt and pepper.    Drain the pasta and toss with the pesto and the rest of the cheese; serve immediately.   
Tuna and Avocado Ceviche,Tested and perfected in the Sur la Table kitchen,home/recipes/appetizers/cold/Tuna and Avocado Ceviche,16 hors d-oeuvres,  1 pound sushi-grade tuna loin cut into  3/4-inch dice 1 bunch green onions white and light green parts only thinly sliced 1 cup diced ( 3/4-inch) avocado 1 tablespoon finely minced jalapeno pepper 3 limes zested and juiced Segments and juice of 1 large orange or grapefruit 2 teaspoons soy sauce plus more as needed 2 garlic cloves peeled Kosher salt and freshly ground white pepper to taste  3/4cup cilantro leaves for garnish Lime wedges for garnish  ,Combine tuna green onions avocado and jalapeno in a large mixing bowl folding together gently with a silicone spatula. Add lime juice orange segments orange juice and soy sauce to the tuna mixture and stir well to combine.  Place garlic cloves on a cutting board and chop roughly. Sprinkle garlic with a large pinch of salt and using the flat side of a chef's knife grind garlic and salt into a smooth paste. Scrape up paste and add to mixing bowl with other ingredients. Taste and season with salt and pepper. Cover ceviche and chill until tuna becomes firm about 1 hour. Taste and season with additional salt pepper and soy sauce as needed.  Garnish ceviche with cilantro leaves and lime wedges and serve immediately. 
Chestnut and Porcini Mushroom Soup with Truffle Cream,Recipe developed for Sur La Table's Cooking Classes,home/recipes/soups-stews/vegetarian/Chestnut and Porcini Mushroom Soup with Truffle Cream,4 to 6 servings,   1/2 ounce dried porcini mushrooms 2 cups hot water 3 tablespoons unsalted butter  1/2 cup finely chopped celery  1/2 cup finely chopped carrot 1 finely chopped leek 3 fresh flat-leaf parsley sprigs  2 whole cloves 1 bay leaf  1/2 cup dry vermouth 6 cups low-sodium chicken broth 1 (14- to 15-ounce) jar peeled cooked whole chestnuts crumbled  1/3 cup Madeira  1/2 cup heavy cream  3/4 teaspoon black pepper  3/4 heavy whipping cream Truffle oil to taste fresh chopped chives to garnish   ,This rich and creamy soup is perfect for a cold winter day or a first course.  Combine porcini mushrooms and 3 cups hot water in medium bowl. Let stand until porcini mushrooms soften about 15 minutes.  Using slotted spoon remove the mushrooms from the liquid and set aside.  Strain the remaining liquid through cheesecloth and set aside.  Melt butter in a 3-quart heavy saucepan over low heat then stir in celery carrot leeks and porcini mushrooms cook until tender about 15 minutes. Deglaze with vermouth and continue to cook for 2-3 minutes more.  Wrap parsley cloves and bay leaf in cheesecloth and tie into a bundle with string to make a bouquet garni.   Add the stock and reserved mushroom liquid along with the bouquet garni and bring to a boil. Reduce heat and simmer covered 20 minutes. Add chestnuts and Madeira and simmer covered for 5 minutes.  Puree soup in small batches (4 or 5) in a blender until smooth (use caution when blending hot liquids) transferring to a 3- to 4-quart heavy saucepan. Stir in cream pepper and salt to taste and reheat soup over moderate heat stirring occasionally.  To serve whip the cream to soft peaks add truffle oil taste.  Ladle soup in the warm soup bowls and garnish with a dollop of the truffle cream and chopped chives.   
Grilled Rosemary Salmon with Nectarine Salsa,Tested and perfected in the Sur la Table kitchen,home/recipes/main-courses/seafood/Grilled Rosemary Salmon with Nectarine Salsa,4 servings,  1 medium shallot peeled and minced 2 large ripe nectarines pitted and diced 1 small red bell pepper cored and diced 1 jalapeno chile stemmed seeded and minced 2 tablespoons fresh lime juice 1 tablespoon minced cilantro   2 tablespoons Dijon mustard 2 tablespoons honey 1 medium garlic clove peeled and minced 1 tablespoon lemon juice 1 1/2 tablespoons minced rosemary 4 (5-ounce) salmon fillets skin-on and pin-bones removed 1 tablespoon olive oil Kosher salt and freshly ground black pepper   ,This easy-to-make rosemary glaze complements the rich flavors of the fish while the salsa provides a sweet yet tangy contrast. Choose ripe nectarines to provide texture and sweetness to the salmon.  To prepare salsa:   Transfer the minced shallot in to a fine-mesh strainer and gently rinse under running water to remove any sharpness. Transfer to a medium bowl and add nectarines pepper jalapeno lime juice and cilantro. Taste and adjust seasoning with salt and pepper.   To prepare glaze:   In a medium bowl use a whisk to combine the mustard honey garlic juice and rosemary. Place half of the glaze in a small bowl and set aside.   Prepare a moderate charcoal fire or preheat a gas grill to medium. Close grill lid and preheat to around 375 degrees F. Alternatively place a large grill pan on the stove over medium heat.   Using a silicone pastry brush lightly coat the grill plates with oil. Lightly season the salmon with salt and pepper and arrange onto the grill plates. Grill the salmon fillets skinned side down over a moderate-heat for about 3 minutes. Using a metal fish spatula turn the salmon use a silicone pastry brush to lightly coat in the glaze and continue to cook until the salmon is slightly pink and starts to flake about 3 more minutes depending on the thickness of the salmon.   To serve:  Transfer salmon to 4 warmed dinner plates drizzle with remaining glaze top with salsa and serve immediately.    
Blossoming Onion with Three Types of Dip,Tested and perfected in the Sur la Table kitchen,home/recipes/appetizers/dips-spreads-sauces-seasonings/Blossoming Onion with Three Types of Dip,1 serving,  Grilled Onions (see directions below for using the Onion Blossom Grilling Set)  Bacon Blue Cheese Dip: 4 bacon slices chopped 2 garlic cloves minced 1 (8-ounce) package cream cheese softened  3/4 cup cream 4 ounces crumbled cambazola or preferred bleu cheese 2 tablespoons chopped fresh chives 2 tablespoons almonds toasted then chopped  Romesco: 4 medium-size ripe tomatoes  1/3 cup plus 1 tablespoon extra-virgin olive oil  3/4 cup sliced almonds  1/2 teaspoon smoked paprika 1 1/2 teaspoons Parmesan cheese grated 1 1/2 teaspoons kosher salt or sea salt plus more to taste  1/2 teaspoon pepper 1 tablespoons red-wine vinegar 2 tablespoons flat leaf parsley 4 slices stale (or toasted) French baguette  Chipotle Garlic Aioli:   1/2 cup mayonnaise (or freshly made Aioli) 2 to 3 tablespoons chipotle chiles in adobo sauce  3/4 teaspoon adobo sauce (from canned chiles)  1/2 teaspoon salt  3/4 teaspoon black pepper 1 3/4 teaspoons garlic powder  3/4 teaspoon lemon juice  ,To use the Onion Blossom Grilling Set: place an onion in the holder and push the corer through the center. Use the knife guides for perfectly even slices taking care not to cut all the way through. Transfer the onion to a grilling rack using the handle for support. Move the rack to your pre-heated grill and enjoy tasty appetizers in no time. WARNING: Racks get hot! Use oven mitt or glove when handling.  To make Bacon Blue Cheese Dip: Cook bacon until crispy reserve fat. Toast minced garlic cloves in bacon fat reserve garlic and discard fat. Beat softened cream cheese with a hand mixer until smooth add cream and mix thoroughly. Mix in garlic bacon chives bleu cheese and almonds. Place mixture into a ceramic 1 cup baking dish and bake at 350 degrees F for 15 minutes until golden bubbly. Serve with grilled onion.  To make Romesco: Slice tomatoes lengthwise and coat with 1 tablespoon olive oil. Place tomatoes on a parchment lined baking sheet and roast at 375 degrees F for 1 to 1  1/2 hours until caramelized peel off skins and discard. In a medium sized saute pan toast almonds over low flame until fragrant and browned. Chop bread and almonds until coarsely minced. Add tomatoes paprika pepper and salt to food processor and puree until well combined. With the food processor running slowly add the red-wine vinegar parsley and remaining olive oil until fully incorporated. Empty food processor into a mixing bowl add bread crumbs chopped almonds and Parmesan whisk to incorporate. Adjust seasonings to taste and serve with grilled onion.  To make Chipotle Garlic Aioli: De-seed and mince the chipotle chiles. Combine with mayonnaise lemon juice adobo sauce salt pepper and garlic powder. Mix thoroughly and serve with grilled onion.  
Charred Scallion Hush Puppies,Le Creuset,home/recipes/appetizers/hot/Charred Scallion Hush Puppies,18 hush puppies,  1 bunch green onions trimmed 1 1/2 cups self-rising flour 1 cup fine yellow cornmeal  1/2 teaspoon baking soda  1/2 teaspoon baking powder 1 tablespoon salt plus more for dusting  3/4 teaspoon cayenne pepper 2 tablespoons melted butter cooled 2 eggs 1 cup buttermilk 3 tablespoons maple syrup 5 to 6 cups Peanut oil    ,Heat cast iron grill pan lid over medium high heat then grill scallions for 3-4 minutes per side until nice grill marks appear and scallions are slightly charred.  Trim and discard any tough green parts then chop finely.  Mix all dry ingredients together in a large bowl and make a well in the center.  Whisk together all wet ingredients and then pour into the well.  Stir together with a wooden spoon until incorporated then let batter rest for 15 minutes.  Heat peanut oil in cast iron dutch oven over medium heat to 375 degrees F and hold that temperature throughout frying.  Using two spoons drop oval hush puppies roughly the size of an egg into the oil and fry for 3 minutes until deep golden brown and cooked through flipping once in oil during cooking.  Continue frying hush puppies in batches of 6.  If hush puppies start to get too dark before the interior is cooked reduce oil temperature slightly.  Remove cooked hushpuppies to a paper towel lined plate and season with an additional pinch of salt while still warm.   
Buttermilk Biscuits with Honey Butter,Simple Comforts: Reprinted with permission of Andrews McMeel Publishing,home/recipes/breads/quick-breads-biscuits/Buttermilk Biscuits with Honey Butter,8 biscuits,  For biscuits:  2 cups unbleached all-purpose flour  1/2 teaspoons baking soda 1 3/4 tablespoon baking powder  3/4 teaspoon kosher salt  1/2 cup cold unsalted butter cut into  1/2 inch cubes  3/4 cup buttermilk 1 large egg beaten  For the honey butter:   1/2 cup unsalted butter softened  3/4 cup honey  3/4 teaspoon kosher salt   , It should take no time to whip up a bunch of these fluffy tender biscuits which are great with chicken but could also be served for breakfast lunch or supper.   Preheat oven to 425 degrees F and position rack in the center. Line a rimmed baking sheet with parchment paper or a silicone mat.  In a large bowl whisk to combine the flour baking soda baking powder and salt. Scatter the butter over the top and mix with a fork to coat the pieces. Using a pastry blender or two butter knives cut the butter into the dry ingredients. Continue cutting until the butter is pea-size and the dough resembles coarse meal. Make a well in the center add the buttermilk and mix with a fork until the mixture forms large clumps and starts to come together.  Transfer the dough to a floured counter and gently knead just until the mixture holds together. Pat the dough into a 7-inch round about 1-inch thick. Using a round 2-inch cutter or water glass cut biscuits and transfer to the prepared sheet spacing about 2 inches apart. Repeat until all the dough is used. Brush the tops with a thin coating of the beaten egg.   Transfer the biscuits to the preheated oven and bake until golden-brown and cooked through about 12 to 14 minutes. Transfer the biscuits to a rack and let cool for at least 5 minutes. Serve warm or at room temperature.   For the honey butter: In a small bowl stir together the softened butter honey and salt using a fork. Set aside.  To serve: Transfer biscuits to a large warmed platter and serve immediately with honey butter.   
